{
 "slug": "food-journey",
 "channel": "body-cast",
 "series": "what_if",
 "hook": "Your lunch is about to travel nine meters, inside you.",
 "twist": "Mouth to exit is one nine-metre tube; the stomach takes four or five hours, the 22-foot small intestine about four, then the large intestine takes the water and its bacteria eat the leftovers.",
 "angle": "A food's-eye trip through the cast: Stomach complains about churning, the microbes cheer for leftovers. One big number: 9 METERS.",
 "why_now": "Scout: 'what happens to food in your body' Shorts (banana digestion) top 103M, median of top 25 7.0M since mid-2024: the strongest body topic.",
 "candidate_sources": [
  "https://en.wikipedia.org/wiki/Human_digestive_system",
  "https://my.clevelandclinic.org/health/body/7041-digestive-system",
  "https://www.niddk.nih.gov/health-information/digestive-diseases/digestive-system-how-it-works"
 ],
 "scores": {
  "hook": 5,
  "surprise": 4,
  "visual": 5,
  "sourceability": 4,
  "timeliness": 2,
  "series_fit": 5
 },
 "risks": [
  "Times vary a lot between people and meals: say 'about'."
 ],
 "approved_by": "user (launch slate, 2026-10-06: 'go ahead, do the whole process for all 12 videos')",
 "approved_at": "2026-10-06"
}